{
  "provenance_version": "0.1",
  "prompt": {
    "id": "incident-summary-generator",
    "name": "Incident Summary Generator",
    "version": "1.0.0",
    "hash": "sha256:a3b1f9e2c6d4e8a0f7b5c2d9e1a4f6b8c0d2e4f6a8b0c2d4e6f8a0b2c4d6e8f0",
    "content_uri": "https://github.com/example-org/llm-prompts/blob/main/prompts/incident-summary-generator/v1.0.0/template.j2",
    "content_type": "text/jinja2"
  },
  "lineage": {},
  "authorship": {
    "created_by": "mirzacausevic@example.com",
    "reviewed_by": ["sre-lead@example.com"],
    "approved_by": "sre-lead@example.com",
    "created_at": "2026-05-12T01:00:00Z",
    "approved_at": "2026-05-12T01:30:00Z"
  },
  "intent": {
    "purpose": "Summarize an incident timeline into a 200-word post-mortem opening section.",
    "in_scope": ["production incidents", "SEV-1 through SEV-3", "synthesized timeline narrative"],
    "out_of_scope": ["root-cause analysis", "remediation recommendations", "blame attribution"],
    "models_supported": ["claude-opus-4-*", "claude-sonnet-4-*", "gpt-4-*"]
  },
  "approval": {
    "state": "deprecated",
    "policy_uri": "https://policy.example.com/prompts/approval-v2"
  },
  "deprecation": {
    "reason": "Superseded by v1.1.0 which adds explicit scope discipline; v1.0.0 produced occasional speculative cause statements.",
    "superseded_by": "incident-summary-generator@1.1.0",
    "deprecated_at": "2026-05-12T02:45:00Z"
  }
}
